Source,Headline,URL,Published At
Pypi.org,pulumi-azure 6.33.0a1771483576,https://pypi.org/project/pulumi-azure/6.33.0a1771483576/,2026-02-19T07:55:47Z
Help Net Security,Compliance Scorecard v10 delivers context-driven AI for explainable compliance decisions,https://www.helpnetsecurity.com/2026/02/19/compliance-scorecard-platform-v10/,2026-02-19T07:52:35Z
C-sharpcorner.com,How Is AI Changing IT Jobs?,https://www.c-sharpcorner.com/article/how-is-ai-changing-it-jobs/,2026-02-19T07:51:24Z
C-sharpcorner.com,What Are the Most In-Demand IT Certifications?,https://www.c-sharpcorner.com/article/what-are-the-most-in-demand-it-certifications/,2026-02-19T07:42:02Z
C-sharpcorner.com,How to Start a Career in Cloud Computing?,https://www.c-sharpcorner.com/article/how-to-start-a-career-in-cloud-computing2/,2026-02-19T07:23:37Z
Pypi.org,remote-store added to PyPI,https://pypi.org/project/remote-store/,2026-02-19T07:11:25Z
Pypi.org,getclaw added to PyPI,https://pypi.org/project/getclaw/,2026-02-19T07:06:24Z
C-sharpcorner.com,How Are IT Companies Using Generative AI in 2026?,https://www.c-sharpcorner.com/article/how-are-it-companies-using-generative-ai-in-2026/,2026-02-19T07:01:31Z
Annielytics.com,Microsoft: Copilot Bug Sent Emails To Its Model Without Consent,https://www.annielytics.com/blog/ai/microsoft-copilot-bug-sent-emails-to-its-model-without-consent/,2026-02-19T05:45:55Z
newsBTC,"Solana (SOL) Pressured Below Key Levels, Further Drop Possible?",http://www.newsbtc.com/analysis/solana-sol-pressured-80/,2026-02-19T05:08:10Z
Globo,Microsoft diz não crer que ICE utilize sua tecnologia para vigiar civis,https://valor.globo.com/empresas/noticia/2026/02/19/microsoft-diz-no-crer-que-ice-utilize-sua-tecnologia-para-vigiar-civis.ghtml,2026-02-19T05:07:02Z
C-sharpcorner.com,Implementing SAML SSO in .NET 10 MVC Using Microsoft Entra ID,https://www.c-sharpcorner.com/article/implementing-saml-sso-in-net-10-mvc-using-microsoft-entra-id/,2026-02-19T05:02:32Z
C-sharpcorner.com,How Does Agile Development Improve Software Delivery?,https://www.c-sharpcorner.com/article/how-does-agile-development-improve-software-delivery/,2026-02-19T04:53:47Z
C-sharpcorner.com,What Are the Best Database Optimization Techniques?,https://www.c-sharpcorner.com/article/what-are-the-best-database-optimization-techniques/,2026-02-19T04:48:38Z
Pypi.org,azure-switchboard 2026.2.6,https://pypi.org/project/azure-switchboard/2026.2.6/,2026-02-19T04:47:19Z
C-sharpcorner.com,How Does Redis Improve Application Performance?,https://www.c-sharpcorner.com/article/how-does-redis-improve-application-performance/,2026-02-19T04:45:42Z
Github.com,Show HN: I built a pre-push safety net for AI-generated code,https://github.com/asamassekou10/ship-safe,2026-02-19T04:42:09Z
C-sharpcorner.com,What Is the Role of Databricks in Big Data?,https://www.c-sharpcorner.com/article/what-is-the-role-of-databricks-in-big-data/,2026-02-19T04:23:41Z
The Times of India,Microsoft says it does not think US ICE uses firm's tech for mass surveillance of civilians,https://economictimes.indiatimes.com/tech/technology/microsoft-says-it-does-not-think-us-ice-uses-firms-tech-for-mass-surveillance-of-civilians/articleshow/128538596.cms,2026-02-19T04:21:24Z
CNA,Microsoft says it does not think US ICE uses firm's tech for mass surveillance of civilians,https://www.channelnewsasia.com/business/microsoft-says-it-does-not-think-us-ice-uses-firms-tech-mass-surveillance-civilians-5939551,2026-02-19T04:21:12Z
